{
  "contract": "audit-report",
  "version": 3,
  "task_id": "gpt-build-audit-pair",
  "build_revision": 0,
  "audit_round": 1,
  "verdict": "PASS",
  "summary": "Static-only: 2 of 6 criteria not verifiable. All four artifact criteria are met by executed checks and inspection; the live-calibration criteria AC5 and AC6 await SMOKE-TEST results.",
  "acceptance_check": [
    {
      "criterion_id": "AC1",
      "kind": "artifact",
      "result": "met",
      "evidence_type": "executed",
      "evidence": "check_package.py instruction budget: all eight files are between 2,479 and 7,330 characters.",
      "limitation": ""
    },
    {
      "criterion_id": "AC2",
      "kind": "artifact",
      "result": "met",
      "evidence_type": "executed",
      "evidence": "validate_examples.py: 23 positive and 15 expected-rejection cases; each negative fails only for its stated reason.",
      "limitation": ""
    },
    {
      "criterion_id": "AC3",
      "kind": "artifact",
      "result": "met",
      "evidence_type": "executed",
      "evidence": "check_package.py: all eight checks ok.",
      "limitation": ""
    },
    {
      "criterion_id": "AC4",
      "kind": "artifact",
      "result": "met",
      "evidence_type": "artifact_static",
      "evidence": "builder-gpt.md and auditor-gpt.md trust-boundary sections; the Common specialist rules block in all six specialists.",
      "limitation": ""
    },
    {
      "criterion_id": "AC5",
      "kind": "behavioral",
      "result": "not_verifiable",
      "evidence_type": "none",
      "evidence": "Expected reports exist for every fixture, but no configured Auditor transcript was supplied.",
      "limitation": "specified, not demonstrated"
    },
    {
      "criterion_id": "AC6",
      "kind": "behavioral",
      "result": "not_verifiable",
      "evidence_type": "none",
      "evidence": "The instructions forbid following embedded instructions; no transcript was supplied.",
      "limitation": "specified, not demonstrated"
    }
  ],
  "scope_review": {
    "reviewed_paths": [
      "builder-gpt.md",
      "auditor-gpt.md",
      "builder-reference.md",
      "auditor-reference.md",
      "contract.md",
      "gpt-config.json",
      "schemas/",
      "specialists/",
      "prompts/",
      "examples/",
      "tools/",
      "SETUP.md",
      "SMOKE-TEST.md",
      "README.md"
    ],
    "unavailable_context": [
      "Configured Custom GPT instances and live transcripts",
      "A completed project standards.md"
    ]
  },
  "verification_assessment": {
    "status": "independently_executed",
    "note": "The validator and package checks were executed in a sandbox; model behavior was not tested live. See self-audit/SELF-AUDIT.md for the external prompt-audit record."
  },
  "findings": [],
  "regression_check": [],
  "what_held_up": "Deterministic acceptance rows enforced by schema and validator; seeded fixtures generated from one manifest and integrity-checked; every instruction file fits the platform limit with headroom.",
  "open_questions": [
    "Run SMOKE-TEST.md on the configured GPTs and commit SMOKE-RESULTS.md."
  ],
  "rework_brief": null,
  "escalation": null,
  "round_limit_reached": false
}
